Если ещё с булавками --,туда-сюда,",",то уметь исчезать из сундука хотел,М. П. Лоскутов. Волшебная палочка (1936),М. П. Лоскутов,1906,Волшебная палочка,1936,1936,XX 1st half,художественная,рассказ,,"М. П. Лоскутов. Рассказ о говорящей собаке. М.: Государственное Издательство Детской Литературы Министерства Просвещения РСФСР, 1958",книга,"Если ещё с булавками -- туда-сюда, то уметь исчезать из сундука хотел, конечно, уж всякий.",булавками,"Ничего, сойдет ",2,Да,существительное,"NOUN, inan, femn plur, ablt",,препозиция,0,0,с булавками,с булавка,Переносное,Присутствует,"Если ещё с булавками -- туда-сюда, то уметь исчезать из сундука хотел, конечно, уж всякий."
Вот она и гнулась,туда-сюда,",",пока не сломалась совсем.,А. В. Козачинский. Стрела и рыба // 1937,А. В. Козачинский,1903,Стрела и рыба,1937,1937,XX 1st half,художественная,рассказ,,,журнал,"Вот она и гнулась туда-сюда, пока не сломалась совсем.",гнулась,"В разные стороны, во все концы",1,Да,глагол (личная форма),"VERB, impf, intr femn, sing, past, indc",конкретного физического действия,препозиция,0,0,гнулась,гнуться,Прямое,Отсутствует,"Вот она и гнулась туда-сюда, пока не сломалась совсем."
С помощником ещё,туда-сюда,",",а одному просто зарез: ударить надо,Андрей Некрасов. Приключения капитана Врунгеля (1937-1939),Андрей Некрасов,1907,Приключения капитана Врунгеля,1937-1939,1937,XX 1st half,художественная,сказка,,А. Некрасов. Приключения капитана Врунгеля,книга,"С помощником ещё туда-сюда, а одному просто зарез: ударить надо посильнее, и мяч отыскать, и палки тащить.",ещё,"Ничего, сойдет ",2,Да,существительное,"NOUN, anim, masc sing, ablt",,препозиция,1,1,с помощником,с помощник,Переносное,Присутствует,"С помощником ещё туда-сюда, а одному просто зарез: ударить надо посильнее, и мяч отыскать, и палки тащить."
Мы,туда-сюда,",",я на крыльцо выбежал -- нет Сергушина.,В. П. Беляев. Старая крепость (1937-1940),В. П. Беляев,1909,Старая крепость,1937-1940,1937,XX 1st half,художественная,роман,,В. Беляев. Старая крепость. Кн. первая и вторая,книга,"Мы туда-сюда, я на крыльцо выбежал -- нет Сергушина.",мы,"В разные стороны, во все концы",1,Да,местоимение,"NPRO, 1per plur, nomn",,препозиция,0,0,мы,мы,Прямое,Отсутствует,"Мы туда-сюда, я на крыльцо выбежал -- нет Сергушина."
,туда-сюда,,"сходить, поговорить...",А. Г. Малышкин. Люди из захолустья (1938),А. Г. Малышкин,1892,Люди из захолустья,1938,1938,XX 1st half,художественная,роман,,"Малышкин А. Г. Сочинения, т. 1-2",книга,"Туда-сюда сходить, поговорить...",,"В разные стороны, во все концы",1,Да,глагол (инфинитив),"INFN, impf, intr",движения,постпозиция,0,0,сходить,сходить,Прямое,Отсутствует,"Туда-сюда сходить, поговорить..."
"кричит, А. А. -- ту-ту, качнет",туда-сюда,",",и ребенок затих.,"В. И. Мухина. Воспоминания Веры Мухиной (1939-1940) // «Искусство», 1957",В. И. Мухина,1889,Воспоминания Веры Мухиной,1939-1940,1939,XX 1st half,публицистика,мемуары,,«Искусство»,журнал,"Волик кричит, А. А. -- ту-ту, качнет туда-сюда, и ребенок затих.",качнет,"В разные стороны, во все концы",1,Да,глагол (личная форма),"VERB, perf, tran sing, 3per, futr, indc",конкретного физического действия,препозиция,0,0,качнет,качнуть,Прямое,Отсутствует,"Волик кричит, А. А. -- ту-ту, качнет туда-сюда, и ребенок затих."
"обложили со всех сторон швета, он",туда,",",сюда -- никуда ему прохода нет: ни,А. Е. Ферсман. Воспоминания о камне (1940),А. Е. Ферсман,1883,Воспоминания о камне,1940,1940,XX 1st half,публицистика,очерк | цикл,геология | наука и технологии,А. Е. Ферсман. Воспоминания о камне,книга,"Но осерчали наши старики, как увидели, что швет стал крошить их, спрятались в тальнике, пособрались с силами и все сразу обложили со всех сторон швета, он туда, сюда -- никуда ему прохода нет: ни к Сейявру спуститься, ни на тундру вылезти, так он и застыл на скале, что над озером висит.",он,"В разные стороны, во все концы",1,Да,местоимение,"NPRO, masc, 3per, Anph sing, nomn",,препозиция,0,0,он,он,Переносное,Отсутствует,"Но осерчали наши старики, как увидели, что швет стал крошить их, спрятались в тальнике, пособрались с силами и все сразу обложили со всех сторон швета, он туда, сюда -- никуда ему прохода нет: ни к Сейявру спуститься, ни на тундру вылезти, так он и застыл на скале, что над озером висит."
"качели, и я буду летать туда-сюда,",туда-сюда,.,,Аркадий Гайдар. Тимур и его команда (1940),Аркадий Гайдар,1904,Тимур и его команда,1940,1940,XX 1st half,художественная,повесть,,А. П. Гайдар. Избранное,книга,"Мама, -- попросила она, -- сделай мне качели, и я буду летать туда-сюда, туда-сюда.",туда-сюда,"В разные стороны, во все концы",1,Да,глагол (инфинитив),"INFN, impf, intr",движения,препозиция,0,0,летать,летать,Прямое,Отсутствует,"Мама, -- попросила она, -- сделай мне качели, и я буду летать туда-сюда, туда-сюда."
"гладь моря, суровые скалистые берега, снующие",туда-сюда,,рыбацкие моторные суда...,"Т. Щапова. На отливе // «Юный натуралист, 1940",Т. Щапова,,На отливе,1940,1940,XX 1st half,публицистика,очерк,природа,«Юный натуралист,журнал,"Бесконечная гладь моря, суровые скалистые берега, снующие туда-сюда рыбацкие моторные суда...",снующие,"В разные стороны, во все концы",1,Да,причастие (полное),"PRTF, impf, intr, pres, actv plur, nomn",движения,препозиция,0,0,снующие,сновать,Прямое,Отсутствует,"Бесконечная гладь моря, суровые скалистые берега, снующие туда-сюда рыбацкие моторные суда..."
"приятель попробовал одну, другую рукоятку, повертел",туда-сюда,.,,митрополит Вениамин (Федченков). На рубеже двух эпох (1940-1950),митрополит Вениамин (Федченков),1880,На рубеже двух эпох,1940-1950,1940,XX 1st half,церковно-богословская,мемуары,религия | философия,"Вениамин (Федченков). На рубеже двух эпох. Подгот. текста, вступ. ст., коммент. А. К. Светозарский",книга,"Хотя доселе он не занимался этим делом, но пока заведующий рабочими куда-то выходил, наш приятель попробовал одну, другую рукоятку, повертел туда-сюда.",повертел,"В разные стороны, во все концы",1,Да,глагол (личная форма),"VERB, perf, tran masc, sing, past, indc",конкретного физического действия,препозиция,0,0,повертел,повертеть,Прямое,Отсутствует,"Хотя доселе он не занимался этим делом, но пока заведующий рабочими куда-то выходил, наш приятель попробовал одну, другую рукоятку, повертел туда-сюда."
"Я хотел ее нагнать, кинулся",туда-сюда,",",но не разыскал: не нашел и,А. А. Бек. Талант (Жизнь Бережкова) / Части 1-3 (1940-1956),А. А. Бек,1903,Талант (Жизнь Бережкова) / Части 1-3,1940-1956,1940,XX 1st half,художественная,роман,,Бек А. Собрание сочинений. В 4-х томах. Волоколамское шоссе. Военные рассказы и очерки,книга,"Я хотел ее нагнать, кинулся туда-сюда, но не разыскал: не нашел и выброшенного подарка.",кинулся,"В разные стороны, во все концы",1,Да,глагол (личная форма),"VERB, perf, intr masc, sing, past, indc",конкретного физического действия,препозиция,0,0,кинулся,кинуться,Прямое,Отсутствует,"Я хотел ее нагнать, кинулся туда-сюда, но не разыскал: не нашел и выброшенного подарка."
Федька вертелся по мастерской,туда-сюда,",","искоса поглядывал на Игнатыча, и Филипп",Б. С. Житков. Виктор Вавич. Книга первая (1941),Б. С. Житков,1882,Виктор Вавич. Книга первая,1941,1941,XX 1st half,художественная,роман,,Б. С. Житков. Виктор Вавич,книга,"Федька вертелся по мастерской туда-сюда, искоса поглядывал на Игнатыча, и Филипп видел, как он вынырнул вон.",мастерской,"В разные стороны, во все концы",1,Да,глагол (личная форма),"VERB, impf, intr masc, sing, past, indc",движения,препозиция,2,2,вертелся,вертеться,Прямое,Отсутствует,"Федька вертелся по мастерской туда-сюда, искоса поглядывал на Игнатыча, и Филипп видел, как он вынырнул вон."
,туда-сюда,",","печенья, огурцы, помидоры, обед...",Г. С. Эфрон. Дневники. Т. 2 (1941-1943),Г. С. Эфрон,1925,Дневники. Т. 2,1941-1943,1941,XX 1st half,бытовая,"дневник, записные книжки",,Эфрон Г. Дневники в 2 т,книга,"Туда-сюда, печенья, огурцы, помидоры, обед...",,Таким или иным образом,3,Нет,Слово отсутствует,Слово отсутствует,,Слово отсутствует,Слово отсутствует,Слово отсутствует,Слово отсутствует,Слово отсутствует,Переносное,Отсутствует,"Туда-сюда, печенья, огурцы, помидоры, обед..."
Посмотрел,туда,",",сюда -- рядом печь старая.,И. А. Ефремов. Путями старых горняков (1942-1943),И. А. Ефремов,1908,Путями старых горняков,1942-1943,1942,XX 1st half,художественная,рассказ,,"Алмазная труба. ― М.: Детгиз, 1954",книга,"Посмотрел туда, сюда -- рядом печь старая.",Посмотрел,"В разные стороны, во все концы",1,Да,глагол (личная форма),"VERB, perf, tran masc, sing, past, indc",восприятия,препозиция,0,0,посмотрел,посмотреть,Прямое,Отсутствует,"Посмотрел туда, сюда -- рядом печь старая."
"не раз видели, как школьники бегали",туда-сюда,,в лес.,Л. А. Кассиль. У классной доски (1942),Л. А. Кассиль,1905,У классной доски,1942,1942,XX 1st half,художественная,рассказ,,Собр. соч.: В 5 т. Т. 3,книга,"Немецкие разведчики не раз видели, как школьники бегали туда-сюда в лес.",бегали,"В разные стороны, во все концы",1,Да,глагол (личная форма),"VERB, impf, intr plur, past, indc",движения,препозиция,0,0,бегали,бегать,Прямое,Отсутствует,"Немецкие разведчики не раз видели, как школьники бегали туда-сюда в лес."
Он подвинул свои шашки,туда-сюда,,и запер шашку Аминбека.,А. П. Платонов. Башкирские народные сказки в пересказе Андрея Платонова (1942-1947),А. П. Платонов,1899,Башкирские народные сказки в пересказе Андрея Платонова,1942-1947,1942,XX 1st half,художественная,сказка,,Андрей Платонов. Собрание сочинений в 5-ти томах,книга,Он подвинул свои шашки туда-сюда и запер шашку Аминбека.,шашки,"В разные стороны, во все концы",1,Да,глагол (личная форма),"VERB, perf, tran masc, sing, past, indc",конкретного физического действия,препозиция,2,2,подвинул,подвинуть,Прямое,Отсутствует,Он подвинул свои шашки туда-сюда и запер шашку Аминбека.
"встала из-за стола и, думая, прошлась",туда-сюда,,по кухне...,Михаил Бубеннов. Белая береза / части 3-6 (1942-1952),Михаил Бубеннов,1909,Белая береза / части 3-6,1942-1952,1942,XX 1st half,художественная,роман,,Бубеннов М. С. Собрание сочинений в четырех томах. ― Т. 2,книга,"Не допив чашку чая, Марийка встала из-за стола и, думая, прошлась туда-сюда по кухне...",прошлась,"В разные стороны, во все концы",1,Да,глагол (личная форма),"VERB, perf, intr femn, sing, past, indc",движения,препозиция,0,0,прошлась,пройтись,Прямое,Отсутствует,"Не допив чашку чая, Марийка встала из-за стола и, думая, прошлась туда-сюда по кухне..."
Не,туда,",",сюда плачьте!,Л. К. Бронтман. Дневники и письма (1943-1946),Л. К. Бронтман,1905,Дневники и письма,1943-1946,1943,XX 1st half,публицистика,"дневник, записные книжки",,Бронтман Л. К. Дневники 1932–1947,книга,"Не туда, сюда плачьте!",Не,"В разные стороны, во все концы",1,Да,глагол (личная форма),"VERB, impf, intr plur, impr, excl",эмоциональные действия,постпозиция,0,0,плачьте,плакать,Переносное,Отсутствует,"Не туда, сюда плачьте!"
"бы где-нибудь, а не бродили бы",туда-сюда,.,,Е. Л. Шварц. Дракон (1943),Е. Л. Шварц,1896,Дракон,1943,1943,XX 1st half,художественная,пьеса | сказка,,Е. Л. Шварц. Пьесы,книга,"Они -- враги любой государственной системы, иначе они обосновались бы где-нибудь, а не бродили бы туда-сюда.",бы,"В разные стороны, во все концы",1,Да,глагол (личная форма),"VERB, impf, intr plur, past, indc",движения,препозиция,0,0,бродили,бродить,Прямое,Отсутствует,"Они -- враги любой государственной системы, иначе они обосновались бы где-нибудь, а не бродили бы туда-сюда."
Я --,туда-сюда,.,,К. А. Федин. Первые радости (1943-1945),К. А. Федин,1892,Первые радости,1943-1945,1943,XX 1st half,художественная,роман,,Федин К. А. Первые радости: Роман. Необыкновенное лето: Роман,книга,Я -- туда-сюда.,я,"Ничего, сойдет ",2,Да,местоимение,"NPRO, 1per sing, nomn",,препозиция,0,0,я,я,Переносное,Отсутствует,Я -- туда-сюда.
Днем ещё,туда-сюда,",",но ночью летали очень много.,Л. К. Бронтман. Дневники и письма (1943-1946),Л. К. Бронтман,1905,Дневники и письма,1943-1946,1943,XX 1st half,публицистика,"дневник, записные книжки",,Бронтман Л. К. Дневники 1932–1947,книга,"Днем ещё туда-сюда, но ночью летали очень много.",ещё,"Ничего, сойдет ",2,Да,существительное,"NOUN, inan, masc sing, ablt",,препозиция,1,1,днем,день,Переносное,Присутствует,"Днем ещё туда-сюда, но ночью летали очень много."
Пока сбегала,туда-сюда,",",уже и отдела народного образования не,А. А. Фадеев. Молодая гвардия (1943-1951),А. А. Фадеев,1901,Молодая гвардия,1943-1951,1943,XX 1st half,художественная,роман,,А. Фадеев. Молодая гвардия,книга,"Пока сбегала туда-сюда, уже и отдела народного образования не осталось...»",сбегала,"В разные стороны, во все концы",1,Да,глагол (личная форма),"VERB, impf, intr femn, sing, past, indc",движения,препозиция,0,0,сбегала,сбегать,Прямое,Отсутствует,"Пока сбегала туда-сюда, уже и отдела народного образования не осталось...»"
По железнодорожным линиям ещё,туда,,"сюда, -- приезжаешь -- уезжаешь, а по гужевым",П. П. Бажов. Отслоения дней (1944-1947),П. П. Бажов,1879,Отслоения дней,1944-1947,1944,XX 1st half,публицистика,"письмо | дневник, записные книжки",,"П. П. Бажов. Собрание сочинений в трех томах. Том третий. Под общей редакцией В. А. Бажовой, А. А. Суркова, Е. А. Пермяка",книга,"По железнодорожным линиям ещё туда сюда, -- приезжаешь -- уезжаешь, а по гужевым каждый раз «доезжаешь» до чего-нибудь совершенно для тебя неожиданного, кричащего: «На Урале всю жизнь прожил, а об этом не подумал!»",ещё,"Ничего, сойдет ",2,Да,существительное,"NOUN, inan, femn plur, datv",,препозиция,1,1,по линиям,по линия,Переносное,Присутствует,"По железнодорожным линиям ещё туда сюда, -- приезжаешь -- уезжаешь, а по гужевым каждый раз «доезжаешь» до чего-нибудь совершенно для тебя неожиданного, кричащего: «На Урале всю жизнь прожил, а об этом не подумал!»"
Смотри,туда-сюда,...,,А. И. Пантелеев. Ночные гости (1944),А. И. Пантелеев,1908,Ночные гости,1944,1944,XX 1st half,художественная,пьеса,,Пантелеев А.И. Собрание сочинений: В 4 т. Т. 1,книга,Смотри туда-сюда...,смотри,"В разные стороны, во все концы",1,Да,глагол (личная форма),"VERB, impf, tran sing, impr, excl",восприятия ,препозиция,0,0,смотри,смотреть,Прямое,Отсутствует,Смотри туда-сюда...
Зимой ещё --,туда-сюда,-,"бураны преужасные, тьма, да и дел",А. Н. Толстой. Петр Первый. Книга третья (1944),А. Н. Толстой,1882,Петр Первый. Книга третья,1944,1944,XX 1st half,художественная,роман,,А. Н. Толстой. Петр Первый,книга,"Зимой ещё -- туда-сюда -- бураны преужасные, тьма, да и дел этой зимой было много...",ещё,"Ничего, сойдет ",2,Да,наречие,ADVB,,препозиция,1,1,зимой,зимой,Переносное,Присутствует,"Зимой ещё -- туда-сюда -- бураны преужасные, тьма, да и дел этой зимой было много..."
