"специального костюма, легко, будто пушинку, переворачивает",туда-сюда,,преподаватель лечебной гимнастики.,"Ольга Гаврилова. Если тебе плохо, ищи того, кому еще хуже // «Сургутская трибуна», 2000.02.26",Ольга Гаврилова,,"Если тебе плохо, ищи того, кому еще хуже",2000,2000,XXI,публицистика,статья,политика и общественная жизнь,«Сургутская трибуна»,газета,"Смотрим, как крохотное тельце, закованное в броню специального костюма, легко, будто пушинку, переворачивает туда-сюда преподаватель лечебной гимнастики.",переворачивает,"В разные стороны, во все концы",1,Да,глагол (личная форма),"VERB, impf, tran sing, 3per, pres, indc",конкретного физического действия,препозиция,0,0,переворачивает,переворачивать,Прямое,Отсутствует,"Смотрим, как крохотное тельце, закованное в броню специального костюма, легко, будто пушинку, переворачивает туда-сюда преподаватель лечебной гимнастики."
"Пошевелил рычажками, погонял суденышко",туда-сюда,",","полавировал между струй, на пробу.","Александр Иличевский. Случай Крымского моста (2000) // «Зарубежные записки», 2007",Александр Иличевский,1970,Случай Крымского моста,2000,2000,XXI,художественная,рассказ,,«Зарубежные записки»,журнал,"Пошевелил рычажками, погонял суденышко туда-сюда, полавировал между струй, на пробу.",суденышко,"В разные стороны, во все концы",1,Да,глагол (личная форма),"VERB, perf, tran masc, sing, past, indc",конкретного физического действия,препозиция,1,1,погонял,погонять,Прямое,Отсутствует,"Пошевелил рычажками, погонял суденышко туда-сюда, полавировал между струй, на пробу."
"они же тяжелые, чего их тягать",туда-сюда,,без толку.,Марианна Баконина. Школа двойников (2000),Марианна Баконина,1964,Школа двойников,2000,2000,XXI,художественная,роман,,Марианна Баконина.Школа двойников,книга,"Развезли по территориальным участкам лишь треть бюллетеней -- они же тяжелые, чего их тягать туда-сюда без толку.",тягать,"В разные стороны, во все концы",1,Да,глагол (инфинитив),"INFN, impf, tran",конкретного физического действия,препозиция,0,0,тягать,тягать,Прямое,Отсутствует,"Развезли по территориальным участкам лишь треть бюллетеней -- они же тяжелые, чего их тягать туда-сюда без толку."
"справлялись со своей работой, монотонно шаркая",туда-сюда,",",словно отсчитывая секунды и почти совпадая,Виктор Доценко. Тридцатого уничтожить! (2000),Виктор Доценко,1946,Тридцатого уничтожить!,2000,2000,XXI,художественная,роман,,Виктор Доценко. Тридцатого уничтожить!,книга,"Щетки на лобовом стекле с трудом справлялись со своей работой, монотонно шаркая туда-сюда, словно отсчитывая секунды и почти совпадая с биением сердца: вжик-вжик... тук-тук... вжик-вжик... тук-тук...",шаркая,"В разные стороны, во все концы",1,Да,деепричастие,"GRND, impf, intr pres",конкретного физического действия,препозиция,0,0,шаркая,шаркать,Прямое,Отсутствует,"Щетки на лобовом стекле с трудом справлялись со своей работой, монотонно шаркая туда-сюда, словно отсчитывая секунды и почти совпадая с биением сердца: вжик-вжик... тук-тук... вжик-вжик... тук-тук..."
"Сейчас восемь, так что дергаться",туда-сюда,.,,Андрей Ростовский. Русский синдикат (2000),Андрей Ростовский,,Русский синдикат,2000,2000,XXI,художественная,роман,,Андрей Ростовский. Русский синдикат,книга,"Сейчас восемь, так что дергаться туда-сюда.",дергаться,"Ничего, сойдет ",2,Да,глагол (инфинитив),"INFN, impf, intr",движения,препозиция,0,0,дергаться,дёргаться,Переносное,Отсутствует,"Сейчас восемь, так что дергаться туда-сюда."
"предместья небольшое число вышедших, случайных пьяных",туда-сюда,",","кого-то, так и не вошедшего в","А. В. Левкин. СПб & т.п // «Уральская новь», 2000",А. В. Левкин,1954,СПб & т.п,2000,2000,XXI,художественная,рассказ,,«Уральская новь»,журнал,"Последний из города паровоз оставлял на перроне этого предместья небольшое число вышедших, случайных пьяных туда-сюда, кого-то, так и не вошедшего в вагон; свет из окон мелькал пятнами по платформе, и, когда сбегал с нее дальше, там уже никого не было.",пьяных,"Ничего, сойдет ",2,Да,существительное,"NOUN, anim, masc plur, accs",,препозиция,0,0,пьяных,пьяный,Переносное,Отсутствует,"Последний из города паровоз оставлял на перроне этого предместья небольшое число вышедших, случайных пьяных туда-сюда, кого-то, так и не вошедшего в вагон; свет из окон мелькал пятнами по платформе, и, когда сбегал с нее дальше, там уже никого не было."
"Но подумал, что штаны ещё",туда-сюда,.,,Андрей Троицкий. Удар из прошлого (2000),Андрей Троицкий,1961,Удар из прошлого,2000,2000,XXI,художественная,роман,,Андрей Троицкий. Удар из прошлого,книга,"Но подумал, что штаны ещё туда-сюда.",ещё,"Ничего, сойдет ",2,Да,существительное,"NOUN, inan, GNdr, Pltm plur, accs",,препозиция,1,1,штаны,штаны,Переносное,Присутствует,"Но подумал, что штаны ещё туда-сюда."
"за куртку, он сам упал, стукнулся,",туда-сюда,.,,Виктор Мясников. Водка (2000),Виктор Мясников,1956,Водка,2000,2000,XXI,художественная,роман,,Виктор Мясников. Водка,книга,"Дернул за куртку, он сам упал, стукнулся, туда-сюда.",стукнулся,Таким или иным образом,3,Нет,Слово отсутствует,Слово отсутствует,,Слово отсутствует,Слово отсутствует,Слово отсутствует,Слово отсутствует,Слово отсутствует,Переносное,Отсутствует,"Дернул за куртку, он сам упал, стукнулся, туда-сюда."
"в очереди постоять надо, разные расходы",туда-сюда,-,изволь теперь устраивать человека на работу.,"Анатолий Азольский. Монахи // «Новый Мир», 2000",Анатолий Азольский,1930,Монахи,2000,2000,XXI,художественная,роман,,«Новый Мир»,журнал,"Другое затруднение: сберкнижка, всего тринадцать тысяч набежало за годы службы, однокомнатная квартира стоит вчетверо меньше, но мебель не бесплатно отпускают в магазине, да ещё и в очереди постоять надо, разные расходы туда-сюда -- изволь теперь устраивать человека на работу.",расходы,"То так, то наоборот ",4,Да,существительное,"NOUN, inan, masc plur, nomn",,препозиция,0,0,расходы,расход,Переносное,Отсутствует,"Другое затруднение: сберкнижка, всего тринадцать тысяч набежало за годы службы, однокомнатная квартира стоит вчетверо меньше, но мебель не бесплатно отпускают в магазине, да ещё и в очереди постоять надо, разные расходы туда-сюда -- изволь теперь устраивать человека на работу."
"Памперсы, коляска,",туда-сюда,.,,Андрей Житков. Супермаркет (2000),Андрей Житков,1962,Супермаркет,2000,2000,XXI,художественная,роман,,Андрей Житков. «Супермаркет»,книга,"Памперсы, коляска, туда-сюда.",коляска,"То так, то наоборот ",4,Нет,Слово отсутствует,Слово отсутствует,,Слово отсутствует,Слово отсутствует,Слово отсутствует,Слово отсутствует,Слово отсутствует,Переносное,Отсутствует,"Памперсы, коляска, туда-сюда."
Но раз ноги кидают,туда-сюда,",","значит, с ней играют, значит, надо","Наталья Бестемьянова, Игорь Бобрин, Андрей Букин. Пара, в которой трое (2000-2001)",Наталья Бестемьянова | Игорь Бобрин | Андрей Букин,1960 | 1953 | 1957-1958,"Пара, в которой трое",2000-2001,2000,XXI,публицистика,мемуары,спорт,"Наталья Бестемьянова, Игорь Бобрин, Андрей Букин. Пара, в которой трое",книга,"Но раз ноги кидают туда-сюда, значит, с ней играют, значит, надо отвечать.",кидают,"В разные стороны, во все концы",1,Да,глагол (личная форма),"VERB, impf, tran plur, 3per, pres, indc",конкретного физического действия,препозиция,0,0,кидают,кидать,Прямое,Отсутствует,"Но раз ноги кидают туда-сюда, значит, с ней играют, значит, надо отвечать."
"мной, полынь что ли, ветер ее",туда-сюда,.,,В. З. Санников. Записки простодушного (2000-2002),В. З. Санников,1929,Записки простодушного,2000-2002,2000,XXI,публицистика,мемуары,частная жизнь,Санников Владимир. Записки простодушного,книга,"И вот кустик передо мной, полынь что ли, ветер ее туда-сюда.",ее,"В разные стороны, во все концы",1,Да,существительное,"NOUN, inan, masc sing, nomn",,препозиция,1,1,ветер,ветер,Переносное,Отсутствует,"И вот кустик передо мной, полынь что ли, ветер ее туда-сюда."
,туда-сюда,-,завтрак...,Олег Гладов. Любовь стратегического назначения (2000-2003),Олег Гладов,,Любовь стратегического назначения,2000-2003,2000,XXI,художественная,роман,,Гладов О. Любовь стратегического назначения,книга,Туда-сюда -- завтрак...,,"Ничего, сойдет ",2,Да,существительное,"NOUN, inan, masc sing, nomn",,постпозиция,0,0,завтрак,завтрак,Переносное,Отсутствует,Туда-сюда -- завтрак...
"хватает, а тут ещё приходится бегать",туда-сюда,,между гаражами».,"Владимир Маккавеев. Дети подземелья // «Формула», 2001.07.15",Владимир Маккавеев,,Дети подземелья,2001,2001,XXI,публицистика,статья,спорт,«Формула»,журнал,"Не случайно Эдди Джордан так расстраивался, вылетев из «большой четверки»: «В Монако и так проблем хватает, а тут ещё приходится бегать туда-сюда между гаражами».",бегать,"В разные стороны, во все концы",1,Да,глагол (инфинитив),"INFN, impf, intr",движения,препозиция,0,0,бегать,бегать,Прямое,Присутствует,"Не случайно Эдди Джордан так расстраивался, вылетев из «большой четверки»: «В Монако и так проблем хватает, а тут ещё приходится бегать туда-сюда между гаражами»."
Да мне бегать,туда-сюда,...,,"Михаил Кураев. Записки беглого кинематографиста // «Новый Мир», 2001",Михаил Кураев,1939,Записки беглого кинематографиста,2001,2001,XXI,художественная,повесть,,«Новый Мир»,журнал,Да мне бегать туда-сюда...,бегать,"В разные стороны, во все концы",1,Да,глагол (инфинитив),"INFN, impf, intr",движения,препозиция,0,0,бегать,бегать,Прямое,Отсутствует,Да мне бегать туда-сюда...
"почти не было, но оно ездило",туда-сюда,,"за лентой, готовое вылететь.",Юрий Петкевич. Явление ангела (2001),Юрий Петкевич,1962,Явление ангела,2001,2001,XXI,художественная,рассказ | цикл,,Юрий Петкевич. Явление ангела,книга,"На шляпе женщины торчало перо, ветра почти не было, но оно ездило туда-сюда за лентой, готовое вылететь.",ездило,"В разные стороны, во все концы",1,Да,глагол (личная форма),"VERB, impf, intr neut, sing, past, indc",движения,препозиция,0,0,ездило,ездить,Прямое,Отсутствует,"На шляпе женщины торчало перо, ветра почти не было, но оно ездило туда-сюда за лентой, готовое вылететь."
Крутнулись,туда-сюда,",",а тут уже и автобус подошел.,Виктор Слипенчук. Зинзивер (2001),Виктор Слипенчук,1941,Зинзивер,2001,2001,XXI,художественная,роман,,Виктор Слипенчук. Зинзивер,книга,"Крутнулись туда-сюда, а тут уже и автобус подошел.",крутнулись,"В разные стороны, во все концы",1,Да,глагол (личная форма),"VERB, perf, intr plur, past, indc",движения,препозиция,0,0,крутнулись,крутнуться,Прямое,Отсутствует,"Крутнулись туда-сюда, а тут уже и автобус подошел."
"пригласили парня, который летает над пляжами",туда-сюда,,на самолётиках с рекламными транспарантами.,"Олег Сулькин. Самоидентификация Брайтон Бич. Эмигранты в США ополчились на «порочащий» фильм // «Известия», 2001.07.27",Олег Сулькин,,Самоидентификация Брайтон Бич. Эмигранты в США ополчились на «порочащий» фильм,2001,2001,XXI,публицистика,статья,искусство и культура,«Известия»,газета,"На роль киллера пригласили парня, который летает над пляжами туда-сюда на самолётиках с рекламными транспарантами.",пляжами,"В разные стороны, во все концы",1,Да,глагол (личная форма),"VERB, impf, intr sing, 3per, pres, indc",движения,препозиция,2,2,летает,летать,Прямое,Отсутствует,"На роль киллера пригласили парня, который летает над пляжами туда-сюда на самолётиках с рекламными транспарантами."
Звонки,туда-сюда,.,,Вениамин Смехов. Театр моей памяти (2001),Вениамин Смехов,1940,Театр моей памяти,2001,2001,XXI,публицистика,мемуары,,Вениамин Смехов. Театр моей памяти,книга,Звонки туда-сюда.,звонки,"В разные стороны, во все концы",1,Да,существительное,"NOUN, inan, masc plur, nomn",,препозиция,0,0,звонки,звонок,Переносное,Отсутствует,Звонки туда-сюда.
Носится с рёвом,туда-сюда,.,,Андрей Геласимов. Фокс Малдер похож на свинью (2001),Андрей Геласимов,1966,Фокс Малдер похож на свинью,2001,2001,XXI,художественная,повесть,,"Геласимов А. Фокс Малдер похож на свинью: Повесть, рассказы",книга,Носится с рёвом туда-сюда.,рёвом,"В разные стороны, во все концы",1,Да,глагол (личная форма),"VERB, impf, intr sing, 3per, pres, indc",движения,препозиция,2,2,носится,носиться,Прямое,Отсутствует,Носится с рёвом туда-сюда.
По сцене в страшном беспокойстве снует,туда-сюда,,режиссёр ПЕТЯ.,"Олег Тихомиров. Без репетиции // «Мурзилка», 2001",Олег Тихомиров,1934,Без репетиции,2001,2001,XXI,художественная,пьеса,,«Мурзилка»,журнал,По сцене в страшном беспокойстве снует туда-сюда режиссёр ПЕТЯ.,снует,"В разные стороны, во все концы",1,Да,глагол (личная форма),"VERB, impf, intr sing, 3per, pres, indc",движения,препозиция,0,0,снует,сновать,Прямое,Отсутствует,По сцене в страшном беспокойстве снует туда-сюда режиссёр ПЕТЯ.
"я, там ресторан и люди ходят",туда-сюда,",","не говоря о том, что мало","Феликс Светов. Чижик-пыжик // «Знамя», 2001",Феликс Светов,1927,Чижик-пыжик,2001,2001,XXI,художественная,повесть,,«Знамя»,журнал,"Они не могут быть закрыты, сказал я, там ресторан и люди ходят туда-сюда, не говоря о том, что мало ли что может произойти, двери всегда должны быть открыты, хотя бы для безопасности.",ходят,"В разные стороны, во все концы",1,Да,глагол (личная форма),"VERB, impf, intr plur, 3per, pres, indc",движения,препозиция,0,0,ходят,ходить,Прямое,Отсутствует,"Они не могут быть закрыты, сказал я, там ресторан и люди ходят туда-сюда, не говоря о том, что мало ли что может произойти, двери всегда должны быть открыты, хотя бы для безопасности."
со вчерашней деловитостью тягать эту пилу,туда-сюда,,"и, уставши, окидывать любовным взором сделанную",Татьяна Набатникова. День рождения кошки (2001),Татьяна Набатникова,1948,День рождения кошки,2001,2001,XXI,художественная,рассказ | цикл,,Татьяна Набатникова. День рождения кошки,книга,"А она: если бы он не совался, то воз и поныне... и так далее, неохота вспоминать, завтра он придет в макетный зал, а его пила торчит, упершись зубьями в прозрачный монолит пластмассы, как он оставил ее вчера, но теперь все уже будет другое, потому что вчера, когда оставил, была дочка, а сейчас больше ее нет у него, и как же надо будет себя обмануть, обвести вокруг пальца, чтобы со вчерашней деловитостью тягать эту пилу туда-сюда и, уставши, окидывать любовным взором сделанную работу.",пилу,"В разные стороны, во все концы",1,Да,глагол (инфинитив),"INFN, impf, tran",конкретного физического действия,препозиция,2,2,тягать,тягать,Прямое,Отсутствует,"А она: если бы он не совался, то воз и поныне... и так далее, неохота вспоминать, завтра он придет в макетный зал, а его пила торчит, упершись зубьями в прозрачный монолит пластмассы, как он оставил ее вчера, но теперь все уже будет другое, потому что вчера, когда оставил, была дочка, а сейчас больше ее нет у него, и как же надо будет себя обмануть, обвести вокруг пальца, чтобы со вчерашней деловитостью тягать эту пилу туда-сюда и, уставши, окидывать любовным взором сделанную работу."
Ходят --,туда-сюда,,ею швыряют.,Самуил Алешин. Встречи на грешной земле (2001),Самуил Алешин,1913,Встречи на грешной земле,2001,2001,XXI,публицистика,мемуары,,Самуил Алешин. Встречи на грешной земле,книга,Ходят -- туда-сюда ею швыряют.,ходят,"В разные стороны, во все концы",1,Да,глагол (личная форма),"VERB, impf, tran plur, 3per, pres, indc",конкретного физического действия,постпозиция,1,-1,швыряют,швырять,Прямое,Отсутствует,Ходят -- туда-сюда ею швыряют.
